{
  "$schema": "../schemas/technologies.schema.json",
  "title": "Squarespace",
  "condition": [
    {
      "type": "HEADERS_SIGNATURE",
      "payload": {
        "headerName": "x-via",
        "regexMatch": "/^1\\.1 echo\\d{3}$/"
      }
    },
    {
      "type": "HEADERS_SIGNATURE",
      "payload": {
        "headerName": "x-contextid",
        "regexMatch": "/^\\w{8}\\/\\w{8}$/"
      }
    }
  ],
  "technology_id": 5,
  "proxyHosts": []
}
