{
  "$schema": "../schemas/technologies.schema.json",
  "title": "Shopify",
  "condition": [
    {
      "type": "HEADERS_SIGNATURE",
      "payload": {
        "headerName": "x-shopify-stage"
      }
    }
  ],
  "technology_id": 2,
  "proxyHosts": ["feeds.datafeedwatch.com", "feeds.adwordsrobot.com"],
  "settings": [
    {
      "name": "Mollie checkout exclusion",
      "condition": [
        {
          "type": "PATH_MATCH",
          "payload": {
            "type": "MATCH_REGEX",
            "value": "/checkouts/([\\w]+)/forward"
          }
        }
      ],
      "value": [
        {
          "type": "excluded_blocks",
          "payload": [
            {
              "value": "#payment-form"
            }
          ]
        }
      ]
    },
    {
      "name": "Shopify Checkout page",
      "condition": [
        {
          "type": "PATH_MATCH",
          "payload": {
            "type": "MATCH_REGEX",
            "value": "/(\\d+)\/checkouts\/(\\w{32})"
          }
        }
      ],
      "value": [
        {
          "type": "whitelist",
          "payload": [
            {
              "value": "table.product-table .product__description__name"
            },
            {
              "value": "aside.sidebar #icons_text_section section div.description"
            }
          ]
        }
      ]
    }
  ]
}
