{
  "$schema": "../../schemas/technologies.schema.json",
  "title": "Squarespace",
  "condition": [
    {
      "type": "RESPONSE_HEADER_MATCH",
      "payload": {
        "name": "x-via",
        "type": "MATCH_REGEX",
        "value": "/^1\\.1 echo\\d{3}$/"
      }
    },
    {
      "type": "RESPONSE_HEADER_MATCH",
      "payload": {
        "name": "x-contextid",
        "type": "MATCH_REGEX",
        "value": "/^\\w{8}\\/\\w{8}$/"
      }
    }
  ],
  "technology_id": 5,
  "proxyHosts": [],
  "settings": [
    {
      "name": "Password protected page",
      "value": [
        {
          "type": "disable_cookie_encoding",
          "payload": ["Locked"]
        }
      ]
    },
    {
      "name": "Sale price",
      "value": [
        {
          "type": "merged_selectors_remove",
          "payload": [{ "value": ".product-price .original-price" }]
        }
      ]
    },
    {
      "name": "Don't proxify scheduling blocks",
      "value": [
        {
          "type": "excluded_blocks",
          "payload": [
            {
              "value": ".acuity-block iframe[data-iframe-translate]"
            }
          ]
        }
      ]
    },
    {
      "name": "Don't translate request id on 404",
      "condition": [
        {
          "type": "PATH_MATCH",
          "payload": {
            "type": "IS_EXACTLY",
            "value": "/404"
          }
        }
      ],
      "value": [
        {
          "type": "excluded_blocks",
          "payload": [
            {
              "value": "body > footer"
            }
          ]
        }
      ]
    }
  ]
}
